{
  "$schema": "../schemas/render-profile.schema.json",
  "id": "qwen-image-2-1",
  "name": "Qwen-Image-2.1",
  "description": "官方 INT8 配置，约 1MP、25 步；支持文生图与多张参考图。",
  "tags": [
    "Qwen",
    "参考图",
    "插画"
  ],
  "architecture_family": "qwen-image-2-1",
  "models": {
    "dit": {
      "filename": "qwen_image_2.1_int8_convrot.safetensors",
      "relative_path": "diffusion_models/qwen_image_2.1_int8_convrot.safetensors",
      "size_bytes": 7256783064,
      "sha256": "cb74113cb03faecd79611b01fd7fd642f0aa60d6f0b95086abee214d75eaa57d",
      "source": "https://huggingface.co/Comfy-Org/Qwen-Image-2.1/resolve/main/diffusion_models/qwen_image_2.1_int8_convrot.safetensors"
    },
    "text_encoder": {
      "filename": "qwen3vl_8b_int8_convrot.safetensors",
      "relative_path": "text_encoders/qwen3vl_8b_int8_convrot.safetensors",
      "size_bytes": 9350798360,
      "sha256": "8bfd0f6e12abf2d2d697ecc888e5e90b0d6741d6708f05799f53afa560452e8f",
      "source": "https://huggingface.co/Comfy-Org/Qwen-Image-2.1/resolve/main/text_encoders/qwen3vl_8b_int8_convrot.safetensors"
    },
    "vae": {
      "filename": "qwen_image_2.1_vae_bf16.safetensors",
      "relative_path": "vae/qwen_image_2.1_vae_bf16.safetensors",
      "size_bytes": 675509688,
      "sha256": "bb21f7473051e1ac368515dd3f2e15cd44d7a11748ee8823e1ddca3e4876b7c9",
      "source": "https://huggingface.co/Comfy-Org/Qwen-Image-2.1/resolve/main/vae/qwen_image_2.1_vae_bf16.safetensors"
    }
  },
  "prompt": {
    "text": "根据以下设定和画面描述创作一幅新画面，动作、表情、视角与构图以画面描述为准。"
  },
  "operations": {
    "candidates": {
      "routes": {
        "empty_latent": {
          "workflow": "qwen-image-2-1-text",
          "recipe": "qwen-image-2-1-candidate"
        },
        "reference_image": {
          "workflow": "qwen-image-2-1-reference",
          "recipe": "qwen-image-2-1-candidate"
        }
      }
    }
  },
  "style_loras": {}
}
