{
  "$schema": "../schemas/render-profile.schema.json",
  "id": "anima-aesthetic-v1-1",
  "name": "Anima Aesthetic v1.1",
  "description": "Anima 的美学微调配置；默认画面更完整，作为 Base 之外的实验性最终出图候选。",
  "tags": [
    "Anima",
    "Aesthetic",
    "动漫",
    "实验配置"
  ],
  "architecture_family": "anima",
  "models": {
    "dit": {
      "filename": "anima-aesthetic-v1.1.safetensors",
      "relative_path": "diffusion_models/anima-aesthetic-v1.1.safetensors",
      "size_bytes": 4182230656,
      "sha256": "3c1868387a3a1ff504bbb87c33678321965ead381fcf87afbd0264daa600c082",
      "source": "https://huggingface.co/circlestone-labs/Anima/resolve/main/split_files/diffusion_models/anima-aesthetic-v1.1.safetensors"
    },
    "text_encoder": {
      "filename": "qwen_3_06b_base.safetensors",
      "relative_path": "text_encoders/qwen_3_06b_base.safetensors",
      "size_bytes": 1192135096,
      "sha256": "cd2a512003e2f9f3cd3c32a9c3573f820bb28c940f73c57b1ddaa983d9223eba",
      "source": "https://huggingface.co/Comfy-Org/Anima_ComfyUI/resolve/main/split_files/text_encoders/qwen_3_06b_base.safetensors"
    },
    "vae": {
      "filename": "qwen_image_vae.safetensors",
      "relative_path": "vae/qwen_image_vae.safetensors",
      "size_bytes": 253806246,
      "sha256": "a70580f0213e67967ee9c95f05bb400e8fb08307e017a924bf3441223e023d1f",
      "source": "https://huggingface.co/Comfy-Org/Anima_ComfyUI/resolve/main/split_files/vae/qwen_image_vae.safetensors"
    }
  },
  "prompt": {
    "policy": "anima-aesthetic-v1-1",
    "fragments": {
      "quality-masterpiece": {
        "polarity": "positive",
        "placement": "prefix",
        "order": 100,
        "prompt_type": "custom_description",
        "prompt_text": "masterpiece"
      },
      "quality-best": {
        "polarity": "positive",
        "placement": "prefix",
        "order": 110,
        "prompt_type": "custom_description",
        "prompt_text": "best quality"
      },
      "quality-safe": {
        "polarity": "positive",
        "placement": "prefix",
        "order": 120,
        "prompt_type": "custom_description",
        "prompt_text": "safe"
      },
      "avoid-blurry": {
        "polarity": "negative",
        "placement": "prefix",
        "order": 100,
        "prompt_type": "danbooru",
        "prompt_text": "blurry"
      },
      "avoid-jpeg-artifacts": {
        "polarity": "negative",
        "placement": "prefix",
        "order": 110,
        "prompt_type": "danbooru",
        "prompt_text": "jpeg artifacts"
      },
      "avoid-text": {
        "polarity": "negative",
        "placement": "prefix",
        "order": 120,
        "prompt_type": "custom_description",
        "prompt_text": "text"
      },
      "avoid-watermark": {
        "polarity": "negative",
        "placement": "prefix",
        "order": 130,
        "prompt_type": "danbooru",
        "prompt_text": "watermark"
      }
    }
  },
  "operations": {
    "candidates": {
      "routes": {
        "empty_latent": {
          "workflow": "anima-candidate-page",
          "recipe": "anima-aesthetic-v1-1-candidate"
        }
      }
    }
  },
  "style_loras": {}
}
