{
  "$schema": "../schemas/render-profile.schema.json",
  "id": "moss-image",
  "name": "MOSS",
  "description": "MOSS SFT INT8 ConvRot；自然语言条目与 Layout，50 步、CFG 3、SLG 22。",
  "tags": [
    "MOSS",
    "插画",
    "布局"
  ],
  "architecture_family": "moss-image",
  "models": {
    "dit": {
      "filename": "moss_image_sft_int8_convrot.safetensors",
      "relative_path": "diffusion_models/moss_image_sft_int8_convrot.safetensors",
      "size_bytes": 5413698958,
      "sha256": "b4d1475bc7eeffd7b809e82ea13a1fba1fb85c4e18365af3813722faa5c0fe4f"
    },
    "text_encoder": {
      "filename": "qwen3.5_9b_w4a8_gptq.safetensors",
      "relative_path": "text_encoders/qwen3.5_9b_w4a8_gptq.safetensors",
      "size_bytes": 7343591088,
      "sha256": "4cc6a1543ad2061806da46f35f90cadb4801dcba246c44782cf42ec0feb6407c"
    },
    "vae": {
      "filename": "flux2-vae_small.safetensors",
      "relative_path": "vae/flux2-vae_small.safetensors",
      "size_bytes": 249521340,
      "sha256": "d8d52ba036475f5fb07c8b435e176d3d97ebfa82f0d1a1c317f9cc1e25bd013b"
    }
  },
  "prompt": {
    "style": [],
    "lighting": []
  },
  "operations": {
    "candidates": {
      "routes": {
        "empty_latent": {
          "workflow": "moss-image-text",
          "recipe": "moss-image-candidate"
        }
      }
    }
  },
  "style_loras": {}
}
